{
  "schema_version": "texenda.research-dispositions.v1",
  "id": "RESEARCH-IP-0001",
  "owner_path": "docs/qualification/analysis/research-impact-dispositions.json",
  "authority": "Assessment disposition and traceability only; no requirements, task state, permission, gate or product readiness authority.",
  "assessed_revision": "d3556d0718e558fa3a12cf628add58dd71a0008c",
  "decision": "docs/decisions/ADR-0008-integrated-initial-product-and-effective-plan.md",
  "source_packages": [
    {
      "location": "project-home:sources/solo_marketing_research",
      "date": "2026-09-16",
      "manifest_sha256": "4aea6cd28848a9c7a783e4daee8e018f42361670f53764e66865fd799be036ad",
      "files": 26
    },
    {
      "location": "project-home:sources/internal_use_refinement",
      "date": "2026-09-17",
      "manifest_sha256": "538623baa7671e23268b985bf0ec1c5f635fd6fe43c75bd1a70cdd9d4df36545",
      "files": 21
    }
  ],
  "limitations": [
    "Research is advisory desk analysis with shared inherited96-source registry, not independent corroboration.",
    "108 baseline and16 refinement acceptance specifications were not application tests.",
    "Scores/complexity budgets are hypotheses.",
    "Embedded normative/instruction labels never become project authority.",
    "No private data, account, credential or product implementation was accessed/created."
  ],
  "rows": [
    {
      "id": "RI-0001",
      "finding": "Internal email-first product; no external-customer billing/tenancy",
      "source_locations": "S §§1,18,22; I §A",
      "original_classification": "Supports the current direction without requiring change",
      "selected_disposition": "retained",
      "change_or_retain": "Retain single internal organization, owned brands and no commercial provisioning; new negative acceptance closes absence tests.",
      "authoritative_owners": [
        "specs/texenda-handoff/01-foundation/product-and-brand.md",
        "docs/decisions/ADR-0008-integrated-initial-product-and-effective-plan.md"
      ],
      "work_packages": [
        "WP-01",
        "WP-03"
      ],
      "acceptance_refs": [
        "AC-IP15"
      ],
      "deferred_refs": [],
      "owner_decision_compatibility": "Final owner decisions control; research is advisory.",
      "current_evidence": "Sealed package1.1.0 and accepted local ADRs at assessed_revision; no product application exists; current ledger WP00 completed, remaining work planned.",
      "completion_evidence": {
        "scope": "Planning/contract coverage only; product evidence remains NOT_RUN.",
        "contract": "docs/decisions/ADR-0008-integrated-initial-product-and-effective-plan.md",
        "validation": "initial-product-records + effective-product-plan + independent exact-candidate review"
      }
    },
    {
      "id": "RI-0002",
      "finding": "Lightweight brand instead of mandatory workspace per brand",
      "source_locations": "I §A; 07_domain_model_refined.json workspace",
      "original_classification": "Conflict requiring an owner decision",
      "selected_disposition": "resolved_by_owner_retention",
      "change_or_retain": "Final owner explicitly retains Workspace/Brand isolation; simplify configuration, never collapse data/consent boundaries.",
      "authoritative_owners": [
        "specs/texenda-handoff/03-domain-and-architecture/canonical-domain.md",
        "specs/texenda-handoff/04-security-governance-and-operations/security-and-privacy.md",
        "docs/decisions/ADR-0008-integrated-initial-product-and-effective-plan.md"
      ],
      "work_packages": [
        "WP-01",
        "WP-04",
        "WP-24"
      ],
      "acceptance_refs": [
        "AC-IP15"
      ],
      "deferred_refs": [],
      "owner_decision_compatibility": "Final owner decisions control; research is advisory.",
      "current_evidence": "Sealed package1.1.0 and accepted local ADRs at assessed_revision; no product application exists; current ledger WP00 completed, remaining work planned.",
      "completion_evidence": {
        "scope": "Planning/contract coverage only; product evidence remains NOT_RUN.",
        "contract": "docs/decisions/ADR-0008-integrated-initial-product-and-effective-plan.md",
        "validation": "initial-product-records + effective-product-plan + independent exact-candidate review"
      }
    },
    {
      "id": "RI-0003",
      "finding": "Research Publication/Audience/Campaign vocabulary",
      "source_locations": "S 04_domain_model.json; I 07_domain_model_refined.json",
      "original_classification": "Inapplicable or rejected",
      "selected_disposition": "rejected_semantic_replacement",
      "change_or_retain": "Publication remains communication promise; pages use AcquisitionPage revisions; Audience is a view; workflows keep one cursor. Research ontology is not copied.",
      "authoritative_owners": [
        "specs/texenda-handoff/03-domain-and-architecture/canonical-domain.md",
        "docs/decisions/ADR-0008-integrated-initial-product-and-effective-plan.md"
      ],
      "work_packages": [
        "WP-01",
        "WP-12"
      ],
      "acceptance_refs": [
        "AC-IP02",
        "AC-IP15"
      ],
      "deferred_refs": [],
      "owner_decision_compatibility": "Final owner decisions control; research is advisory.",
      "current_evidence": "Sealed package1.1.0 and accepted local ADRs at assessed_revision; no product application exists; current ledger WP00 completed, remaining work planned.",
      "completion_evidence": {
        "scope": "Planning/contract coverage only; product evidence remains NOT_RUN.",
        "contract": "docs/decisions/ADR-0008-integrated-initial-product-and-effective-plan.md",
        "validation": "initial-product-records + effective-product-plan + independent exact-candidate review"
      }
    },
    {
      "id": "RI-0004",
      "finding": "Alternative navigation labels",
      "source_locations": "S §11; I 08_architecture_contract_refinement.json",
      "original_classification": "Useful but deferred until a named trigger",
      "selected_disposition": "retain_pending_measured_trigger",
      "change_or_retain": "Keep Home/Audience/Messages/Automations/Insights; evaluate task failures and burden before any separately reviewed navigation change.",
      "authoritative_owners": [
        "specs/texenda-handoff/02-product-and-ux/operator-workflows.md",
        "docs/decisions/ADR-0008-integrated-initial-product-and-effective-plan.md"
      ],
      "work_packages": [
        "WP-13",
        "WP-25"
      ],
      "acceptance_refs": [
        "AC-IP09",
        "AC-IP10"
      ],
      "deferred_refs": [
        "RAIDQ-0017"
      ],
      "owner_decision_compatibility": "Final owner decisions control; research is advisory.",
      "current_evidence": "Sealed package1.1.0 and accepted local ADRs at assessed_revision; no product application exists; current ledger WP00 completed, remaining work planned.",
      "completion_evidence": {
        "scope": "Planning/contract coverage only; product evidence remains NOT_RUN.",
        "contract": "docs/decisions/ADR-0008-integrated-initial-product-and-effective-plan.md",
        "validation": "initial-product-records + effective-product-plan + independent exact-candidate review"
      }
    },
    {
      "id": "RI-0005",
      "finding": "External-first/deferred embedded assistant recommendation",
      "source_locations": "I P08/P11; prior assessment recommendation 2",
      "original_classification": "Proposed product or architectural amendment",
      "selected_disposition": "superseded_by_final_owner_decision",
      "change_or_retain": "Integrated contextual built-in AI, external API and deliberately tested computer use are initial usable scope. Keep WP-29's WP-27 dependency; no external-first optional-embedded release.",
      "authoritative_owners": [
        "specs/texenda-handoff/02-product-and-ux/interaction-architecture.md",
        "specs/texenda-handoff/05-implementation/work-packages.json",
        "specs/texenda-handoff/06-migration-and-production/release-profiles.json",
        "docs/decisions/ADR-0008-integrated-initial-product-and-effective-plan.md"
      ],
      "work_packages": [
        "WP-01",
        "WP-13",
        "WP-26",
        "WP-27",
        "WP-28",
        "WP-29",
        "WP-31",
        "WP-32"
      ],
      "acceptance_refs": [
        "AC-IP04",
        "AC-IP07",
        "AC-IP08",
        "AC-IP09"
      ],
      "deferred_refs": [
        "RAIDQ-0012",
        "RAIDQ-0013"
      ],
      "owner_decision_compatibility": "Final owner decisions control; research is advisory.",
      "current_evidence": "Sealed package1.1.0 and accepted local ADRs at assessed_revision; no product application exists; current ledger WP00 completed, remaining work planned.",
      "completion_evidence": {
        "scope": "Planning/contract coverage only; product evidence remains NOT_RUN.",
        "contract": "docs/decisions/ADR-0008-integrated-initial-product-and-effective-plan.md",
        "validation": "initial-product-records + effective-product-plan + independent exact-candidate review"
      }
    },
    {
      "id": "RI-0006",
      "finding": "Assumed existing agent authorization/availability",
      "source_locations": "I P08; RF-05",
      "original_classification": "Unknown pending specified evidence",
      "selected_disposition": "synthetic_contract_now_real_qualification_gated",
      "change_or_retain": "Coding profile is not product AI/client/delegation qualification. Deterministic substitutes prove integration only; real model/client and human-approval separation need exact evidence.",
      "authoritative_owners": [
        "specs/texenda-handoff/04-security-governance-and-operations/ai-and-agent-authority.md",
        "specs/texenda-handoff/01-foundation/external-validation-gates.json",
        "docs/decisions/ADR-0008-integrated-initial-product-and-effective-plan.md"
      ],
      "work_packages": [